{
  "schema_version": "1.0",
  "article_ref": "/home/lyric/growth-engine-pipeline/content/library/articles/article_x/20260320_article_x_recheck/x-gorden_sun-4d1bb97e37f3/article_draft.json",
  "source_ref": "/home/lyric/growth-engine-pipeline/content/runs/20260320_article_x_recheck/03_source_items/article_x/items/x-gorden_sun-4d1bb97e37f3/source_item.json",
  "style_profile_id": "editorial_knowledge_graphic_v1",
  "output_language": "zh-CN",
  "global_visual_rules": {
    "style_direction": "editorial knowledge graphic, warm light background, flat diagram-first composition, mobile legibility first",
    "palette": {
      "background": "warm cream paper-like background",
      "primary_accents": [
        "warm orange",
        "coral red",
        "teal green"
      ],
      "linework": "soft dark gray line work",
      "secondary_neutrals": [
        "light gray",
        "off-white"
      ]
    },
    "must_have": [
      "clear information hierarchy",
      "diagram-first composition",
      "short Chinese labels",
      "editorial infographic feeling",
      "high readability on mobile"
    ],
    "must_avoid": [
      "generic AI wallpaper",
      "cyberpunk neon",
      "photorealistic people",
      "blue digital rain",
      "low-information decoration"
    ]
  },
  "cover_image": {
    "image_id": "cover_01",
    "role": "cover",
    "purpose": "Compress the article's main idea into one visual system that is understandable in one glance.",
    "image_grammar": "hook_cover",
    "diagram_type": "stage_evolution",
    "concept_summary": "Mamba-3 这次最关键的变化，不是再讲训练提速，而是把注意力从“怎么更快预训练”转向“怎么在不加推理延迟的前提下，把质量继续往上推”。",
    "reference_image_urls": [],
    "scene_elements": [
      "one dominant visual idea",
      "2-4 large visual nodes max",
      "clear title area",
      "one obvious structure"
    ],
    "key_relationships": [
      "present one question and one promise",
      "make the article worth clicking in one glance"
    ],
    "on_canvas_text": {
      "headline": "重写推理的账本",
      "subheadline": "不是Mamba 又更新了",
      "short_labels": []
    },
    "composition": {
      "aspect_ratio": "5:2",
      "layout_pattern": "diagram_left_text_right",
      "text_position": "right",
      "diagram_focus": "single central system diagram"
    },
    "visual_constraints": [
      "wide editorial banner",
      "clean empty space",
      "flat shapes with restrained accents",
      "short labels only"
    ],
    "negative_constraints": [
      "no photorealism",
      "no dense paragraphs in image",
      "no random sci-fi effects"
    ],
    "generation_prefs": {
      "aspect_ratio": "21:9",
      "resolution": "2K",
      "output_format": "png"
    },
    "text_budget": {
      "max_text_blocks": 2,
      "headline_max_chars": 16,
      "subheadline_max_chars": 16,
      "label_max_chars": 8,
      "max_labels": 4
    },
    "prompt_seed": "Make this a hook-first cover. One question or tension, one promise, not a dense summary. Source context: Gorden_Sun"
  },
  "inline_images": [
    {
      "image_id": "inline_01",
      "role": "inline",
      "purpose": "Reset attention at the first major section transition and summarize the new concept block.",
      "image_grammar": "example_comparison",
      "diagram_type": "stage_evolution",
      "concept_summary": "如果你还在把模型架构升级理解成一场参数和 benchmark 的军备竞赛，那 Mamba-3 这篇博客真正想纠正的，可能正是这种看法。它不是在说“我们又做了个更强版本”，而是在说：当后训练、RL rollout、agent workflow 都开始把推理压力推到天花板附近，架构…",
      "section_ref": "framing",
      "placement_rule": "Insert near the start of framing to reset attention at this section transition.",
      "reference_image_urls": [],
      "scene_elements": [
        "left card vs right card",
        "center arrow",
        "one bottom takeaway",
        "few text blocks"
      ],
      "key_relationships": [
        "make the before/after or old/new contrast obvious",
        "show why one example proves the point"
      ],
      "on_canvas_text": {
        "headline": "在说：当后训练、RL…",
        "subheadline": "不是在说 我们又做…",
        "short_labels": []
      },
      "composition": {
        "aspect_ratio": "16:9",
        "layout_pattern": "single_concept_centered",
        "text_position": "integrated",
        "diagram_focus": "one section concept"
      },
      "visual_constraints": [
        "keep labels short",
        "focus on one concept only",
        "maintain same house style as cover"
      ],
      "negative_constraints": [
        "no decorative filler",
        "no unrelated icons"
      ],
      "generation_prefs": {
        "aspect_ratio": "16:9",
        "resolution": "1K",
        "output_format": "png"
      },
      "text_budget": {
        "max_text_blocks": 4,
        "headline_max_chars": 12,
        "subheadline_max_chars": 10,
        "label_max_chars": 8,
        "max_labels": 6
      },
      "prompt_seed": "Use the example_comparison grammar. This is one visual job, not a paragraph summary: 这次真正值得看的，不是又多了一个新版本号，而是模型架构…"
    },
    {
      "image_id": "inline_02",
      "role": "inline",
      "purpose": "Reset attention at the first major section transition and summarize the new concept block.",
      "image_grammar": "workflow_map",
      "diagram_type": "workflow_map",
      "concept_summary": "Mamba-2 当年押注的是训练效率，所以通过大量简化底层状态空间机制，换来了 2 到 8 倍的训练提速。但今天的瓶颈已经不只在预训练。部署、后训练、强化学习 rollout，以及 Codex、Claude Code 这类 agent workflow，都把“推理是不是够便宜、…",
      "section_ref": "section_02",
      "placement_rule": "Insert near the start of section_02 to reset attention at this section transition.",
      "reference_image_urls": [],
      "scene_elements": [
        "3-4 step modules",
        "arrows",
        "artifact or action icons"
      ],
      "key_relationships": [
        "show how the system operates",
        "make stage handoff obvious"
      ],
      "on_canvas_text": {
        "headline": "Mamba-2 解决的…",
        "subheadline": "",
        "short_labels": [
          "Mamba-2…",
          "Mamba-3…"
        ]
      },
      "composition": {
        "aspect_ratio": "16:9",
        "layout_pattern": "single_concept_centered",
        "text_position": "integrated",
        "diagram_focus": "one section concept"
      },
      "visual_constraints": [
        "keep labels short",
        "focus on one concept only",
        "maintain same house style as cover"
      ],
      "negative_constraints": [
        "no decorative filler",
        "no unrelated icons"
      ],
      "generation_prefs": {
        "aspect_ratio": "16:9",
        "resolution": "1K",
        "output_format": "png"
      },
      "text_budget": {
        "max_text_blocks": 3,
        "headline_max_chars": 12,
        "subheadline_max_chars": 12,
        "label_max_chars": 8,
        "max_labels": 4
      },
      "prompt_seed": "Use the workflow_map grammar. This is one visual job, not a paragraph summary: Mamba-2 解决的是训练瓶颈，Mamba-3 盯上的是推理瓶颈"
    },
    {
      "image_id": "inline_03",
      "role": "inline",
      "purpose": "Reset attention at the first major section transition and summarize the new concept block.",
      "image_grammar": "example_comparison",
      "diagram_type": "workflow_map",
      "concept_summary": "Mamba-3 的核心价值，不是继续从训练优先的角度调旧结构，而是反过来问：如果今天真正昂贵的是推理，那一个为推理而设计的状态空间模型应该长什么样？博客里给出的结论也很清楚：固定状态带来了线性复杂度，但也要求模型把更多过去信息压缩进同一个表示里。问题不在于谁更高级，而在于当推理…",
      "section_ref": "section_03",
      "placement_rule": "Insert near the start of section_03 to reset attention at this section transition.",
      "reference_image_urls": [],
      "scene_elements": [
        "left card vs right card",
        "center arrow",
        "one bottom takeaway",
        "few text blocks"
      ],
      "key_relationships": [
        "make the before/after or old/new contrast obvious",
        "show why one example proves the point"
      ],
      "on_canvas_text": {
        "headline": "反过来问：如果今天真正…",
        "subheadline": "不是继续从训练优先…",
        "short_labels": [
          "让 recur…",
          "给 trans…",
          "在每次更新里加…"
        ]
      },
      "composition": {
        "aspect_ratio": "16:9",
        "layout_pattern": "single_concept_centered",
        "text_position": "integrated",
        "diagram_focus": "one section concept"
      },
      "visual_constraints": [
        "keep labels short",
        "focus on one concept only",
        "maintain same house style as cover"
      ],
      "negative_constraints": [
        "no decorative filler",
        "no unrelated icons"
      ],
      "generation_prefs": {
        "aspect_ratio": "16:9",
        "resolution": "1K",
        "output_format": "png"
      },
      "text_budget": {
        "max_text_blocks": 4,
        "headline_max_chars": 12,
        "subheadline_max_chars": 10,
        "label_max_chars": 8,
        "max_labels": 6
      },
      "prompt_seed": "Use the example_comparison grammar. This is one visual job, not a paragraph summary: 这篇博客最有价值的，是把架构取舍讲明白了"
    },
    {
      "image_id": "inline_04",
      "role": "inline",
      "purpose": "Reset attention at the first major section transition and summarize the new concept block.",
      "image_grammar": "example_comparison",
      "diagram_type": "stage_evolution",
      "concept_summary": "过去一段时间，很多架构讨论默认把“训练更省”当成第一目标；但当后训练和 agent usage 爆炸式增长之后，质量和推理效率之间的边界开始变得更重要。你不只是想让模型更会做题，你还想让它在真实推理账单面前依然成立。Mamba-3 其实是在回应这个更现实的问题。",
      "section_ref": "section_04",
      "placement_rule": "Insert near the start of section_04 to reset attention at this section transition.",
      "reference_image_urls": [],
      "scene_elements": [
        "left card vs right card",
        "center arrow",
        "one bottom takeaway",
        "few text blocks"
      ],
      "key_relationships": [
        "make the before/after or old/new contrast obvious",
        "show why one example proves the point"
      ],
      "on_canvas_text": {
        "headline": "更重要的是，它在提醒大…",
        "subheadline": "一个具体例子就够了",
        "short_labels": [
          "更重要的是",
          "它在提醒大家",
          "推理时代的判断…"